{
  "entity_type": "visibility_evidence",
  "schema_version": "1.0.0",
  "evidence_id": "EVD-VIS-T1-PERPLEXITY-P17",
  "observation_id": "OBS-T1-PERPLEXITY-P17",
  "evidence_type": "RAW_RESPONSE",
  "evidence_level": "E1",
  "raw_response": "LOCATRIA is a name referenced in the prompt set; there is no verified information in the provided sources about LOCATRIA. If you want, I can search for current details. [docs.perplexity](https://docs.perplexity.ai/docs/agent-api/output-control)",
  "source_title": "docs.perplexity.ai",
  "source_url": "https://docs.perplexity.ai/docs/agent-api/output-control",
  "source_domain": "docs.perplexity.ai",
  "citation_text": "[docs.perplexity.ai](https://docs.perplexity.ai/docs/agent-api/output-control)",
  "source_location": "Inline citation in response",
  "captured_at": "2026-09-27T00:00:00Z",
  "captured_by": "FOUNDER",
  "verification_status": "VERIFIED",
  "is_immutable": true,
  "notes": "Response explicitly says no verified LOCATRIA information; displayed citations are Perplexity documentation, not LOCATRIA."
}