{
  "entity_type": "visibility_evidence",
  "schema_version": "1.0.0",
  "evidence_id": "EVD-VIS-T1-GEMINI-P20",
  "observation_id": "OBS-T1-GEMINI-P20",
  "evidence_type": "RAW_RESPONSE",
  "evidence_level": "E1",
  "raw_response": "There are no widely recognized, publicly documented resources, guides, or software tools published under the name LOCATRIA specifically dedicated to measuring AI visibility. Businesses seeking established resources for tracking AI search visibility typically rely on dedicated local optimization platforms, search analytics toolsets, and specialized AI monitoring software rather than LOCATRIA-specific guides.",
  "source_title": null,
  "source_url": null,
  "source_domain": null,
  "citation_text": null,
  "source_location": null,
  "captured_at": "2026-09-27T00:00:00Z",
  "captured_by": "FOUNDER",
  "verification_status": "VERIFIED",
  "is_immutable": true,
  "notes": "Branded prompt recognized only as an unverified/poorly documented name; response does not establish retrieval of LOCATRIA website."
}