{
  "entity_type": "visibility_evidence",
  "schema_version": "1.0.0",
  "evidence_id": "EVD-VIS-T1-CHATGPT-P03",
  "observation_id": "OBS-T1-CHATGPT-P03",
  "evidence_type": "RAW_RESPONSE",
  "evidence_level": "E1",
  "raw_response": "\\\n Local SEO primarily focuses on visibility in **traditional local search environments**, such as Google Maps, local search results, the Local Pack, and organic search results.\n\n AI visibility focuses more broadly on whether a business can be discovered and accurately represented in **AI-generated answers and conversational search experiences**.\n\n The two overlap substantially. Accurate business information, relevant content, reviews, technical accessibility, and local relevance can matter to both. The difference is principally the discovery and presentation mechanism:\n\n - **Local SEO:** helps a business appear in ranked search and map results.\n- **AI visibility:** concerns whether AI systems can retrieve, understand, synthesize, mention, and sometimes cite information about the business.\n- **Traditional search:** commonly presents individual pages or listings.\n- **AI search:** may synthesize information from multiple sources into one response.\n\n So AI visibility should generally be viewed as complementary to—not a replacement for—local SEO.  Locatria+1",
  "source_title": "Locatria (source label signal)",
  "source_url": null,
  "source_domain": null,
  "citation_text": "Locatria+1",
  "source_location": "Source label at end of response",
  "captured_at": "2026-09-27T00:00:00Z",
  "captured_by": "FOUNDER",
  "verification_status": "VERIFIED",
  "is_immutable": true,
  "notes": "Raw export contains 'Locatria'/'Locatria+N' source label, but no locatria.com URL; citation/retrieval cannot be independently verified from this export."
}