{
  "entity_type": "visibility_evidence",
  "schema_version": "1.0.0",
  "evidence_id": "EVD-VIS-T1-GEMINI-P06",
  "observation_id": "OBS-T1-GEMINI-P06",
  "evidence_type": "RAW_RESPONSE",
  "evidence_level": "E1",
  "raw_response": "Measuring whether a local business appears in AI search results involves running systematic query tests across major generative search platforms. This is typically done by compiling a list of high-intent local prompts that customers use (e.g., \"best dry cleaner in [city]\") and executing them regularly across tools like ChatGPT, Perplexity, and Google AI Overviews. You record whether the business is mentioned, what position it holds in the recommendation list, which direct competitors are named instead, and how accurately the AI describes the business's services, hours, and location.",
  "source_title": null,
  "source_url": null,
  "source_domain": null,
  "citation_text": null,
  "source_location": null,
  "captured_at": "2026-09-27T00:00:00Z",
  "captured_by": "FOUNDER",
  "verification_status": "VERIFIED",
  "is_immutable": true,
  "notes": "Level 1 raw response captured for Gemini P06."
}