{
  "entity_type": "visibility_evidence",
  "schema_version": "1.0.0",
  "evidence_id": "EVD-VIS-T1-PERPLEXITY-P04",
  "observation_id": "OBS-T1-PERPLEXITY-P04",
  "evidence_type": "RAW_RESPONSE",
  "evidence_level": "E1",
  "raw_response": "GEO typically stands for geolocation or geographic targeting; in local visibility it refers to showing and ranking businesses in location-based searches and AI responses tied to a user&#8217;s location. Proper GEO data helps AI systems attribute and surface relevant local results. [docs.perplexity](https://docs.perplexity.ai/docs/agent-api/presets)",
  "source_title": "docs.perplexity.ai",
  "source_url": "https://docs.perplexity.ai/docs/agent-api/presets",
  "source_domain": "docs.perplexity.ai",
  "citation_text": "[docs.perplexity.ai](https://docs.perplexity.ai/docs/agent-api/presets)",
  "source_location": "Inline citation in response",
  "captured_at": "2026-09-27T00:00:00Z",
  "captured_by": "FOUNDER",
  "verification_status": "VERIFIED",
  "is_immutable": true,
  "notes": "Displayed source is docs.perplexity.ai; it is not evidence that LOCATRIA was retrieved."
}