{
  "entity_type": "visibility_evidence",
  "schema_version": "1.0.0",
  "evidence_id": "EVD-VIS-T1-GEMINI-P18",
  "observation_id": "OBS-T1-GEMINI-P18",
  "evidence_type": "RAW_RESPONSE",
  "evidence_level": "E1",
  "raw_response": "Because LOCATRIA is not a universally recognized standard industry platform with widespread public documentation, its exact features can vary depending on context. Generally, platforms or tools utilizing similar names or frameworks are designed to assist local businesses with regional visibility, optimizing location-based search performance, managing digital directory footprints, and streamlining local marketing execution to attract nearby customers.",
  "source_title": null,
  "source_url": null,
  "source_domain": null,
  "citation_text": null,
  "source_location": null,
  "captured_at": "2026-09-27T00:00:00Z",
  "captured_by": "FOUNDER",
  "verification_status": "VERIFIED",
  "is_immutable": true,
  "notes": "Branded prompt recognized only as an unverified/poorly documented name; response does not establish retrieval of LOCATRIA website."
}